{
  "grant_id": "cg-0001",
  "subject_id": "svc/effect-kernel",
  "workload_id": "mission/alpha",
  "operations": [
    "ledger.append"
  ],
  "resources": [
    {
      "type": "ledger"
    }
  ],
  "purpose": "append records",
  "not_before": "2026-08-31T12:00:00Z",
  "expires_at": "2026-09-30T12:00:00Z",
  "budget": {
    "cpu_seconds": 3600
  },
  "delegation_depth": 0,
  "parent_grant_id": null,
  "parent_authority_digest": null,
  "authority_digest": null,
  "holder_binding": null,
  "audience": "internal",
  "generation": 1,
  "revocation_state": "ACTIVE",
  "nonce": "n1"
}
